{
  "firstContact": {
    "preparation": ["了解客户背景（公司、行业、规模）", "准备2-3个同行业案例", "准备好报价区间", "准备好需求确认问题清单"],
    "steps": [
      { "name": "破冰", "duration": "5分钟", "tasks": ["自我介绍：我是谁、做什么、做过什么", "先聊聊您的情况"] },
      { "name": "了解需求", "duration": "15分钟", "tasks": ["用引导问题清单", "重点搞清楚：现在怎么做、痛点是什么、期望达到什么效果"] },
      { "name": "初步方案", "duration": "10分钟", "tasks": ["基于了解的情况给出初步方向", "不要当场报精确价格，留出buffer"] },
      { "name": "确认意向", "duration": "5分钟", "tasks": ["您觉得这个方向可以吗？", "预算大概在什么范围？", "希望什么时候开始？"] },
      { "name": "约定下一步", "duration": "5分钟", "tasks": ["回去做个详细方案X天内发给您", "交换联系方式"] }
    ],
    "postContact": ["30分钟内发感谢消息", "24小时内整理沟通记录", "48小时内发出详细方案", "把客户信息录入客户管理表"]
  },
  "depositRules": {
    "scales": [
      { "range": "500-1000元", "ratio": "100%", "note": "全额预付" },
      { "range": "1001-3000元", "ratio": "50%", "note": "500-1500元" },
      { "range": "3001-10000元", "ratio": "40%", "note": "1200-4000元" },
      { "range": "10001元以上", "ratio": "30%", "note": "3000元起" }
    ],
    "timing": ["签订合同/确认合作后立即收取", "收到定金后才开始正式工作", "没收到定金不开工"],
    "script": "定金是为了确认双方的合作意向。收到定金后我会立即开始工作，定金不可退。",
    "nonRefundable": ["客户单方面取消项目（已开工的情况下）", "客户30天不回复导致项目停滞", "客户要求超出原始需求范围且拒绝加钱"],
    "refundable": ["我方原因导致项目无法完成", "技术评估后发现不可行（未开工的情况下）", "双方协商一致取消"]
  },
  "paymentRules": {
    "finalPayment": "验收通过后3个工作日内支付",
    "acceptanceProcess": ["我提交交付物+验收清单", "客户3个工作日内完成验收", "验收通过→支付尾款", "验收不通过→列出问题清单→修改→再次验收", "验收期满客户不回复→视为验收通过"],
    "collectionScript": {
      "day1": "X总，项目验收通过了，尾款方便这两天转一下吗？",
      "day3": "X总，尾款的事提醒一下。您看什么时候方便转？",
      "day7": "X总，项目尾款已经拖了一周了。如果您有什么困难可以跟我说。",
      "day14": "X总，尾款的事最后确认一下。如果本周内还没有收到尾款，我将暂停售后支持服务。"
    },
    "badDebtStrategy": [
      { "range": "<1000元", "action": "当做学费，不再合作" },
      { "range": "1000-5000元", "action": "持续催款，保留沟通记录" },
      { "range": ">5000元", "action": "考虑法律途径" }
    ]
  },
  "projectSchedule": {
    "phases": [
      { "name": "需求确认", "days": "1-2", "tasks": ["发送需求确认表", "客户填写并返回", "电话/视频确认需求", "输出需求文档"] },
      { "name": "方案设计", "days": "2-3", "tasks": ["技术方案设计", "功能清单确认", "客户确认方案"] },
      { "name": "开发搭建", "days": "3-6", "tasks": ["环境搭建", "核心功能开发", "功能自测", "每日汇报进度"] },
      { "name": "测试调试", "days": "6-7", "tasks": ["功能测试", "客户测试", "问题修复"] },
      { "name": "部署上线", "days": "7-8", "tasks": ["正式环境部署", "操作培训", "文档交付"] },
      { "name": "验收交接", "days": "8-9", "tasks": ["客户验收", "问题清单处理", "尾款收取"] },
      { "name": "售后支持", "days": "9-30", "tasks": ["问题响应（工作日24小时内）", "小修小补（免费）", "大改动（另行报价）"] }
    ]
  }
}
